{
  "schemaVersion": 1,
  "policy": {
    "schemaVersion": 1,
    "id": "codex-relative-efficiency-v1",
    "baselineSurface": "codex-cli",
    "candidateSurface": "piagent",
    "estimand": "fixed-workload-family-geometric-mean",
    "outcomeConditioning": "none",
    "attemptPolicy": "accepted-plus-exact-provider-started-failed-attempts",
    "maximumTotalTokenTrafficRatio": 0.7,
    "maximumTotalTokenTrafficRatioUpper95": 0.7,
    "maximumApiEquivalentCostRatio": 0.7,
    "maximumApiEquivalentCostRatioUpper95": 0.7,
    "maximumSubagentSessionsPerAttempt": 1,
    "maximumSubagentTrafficShare": 0.05
  },
  "required": true,
  "claim": "Piagent uses at least 30% less total provider traffic and API-equivalent cost than Codex CLI on the same work.",
  "billedOrSubscriptionCost": false,
  "costBoundary": "API-equivalent text-token pricing; not OAuth subscription debiting",
  "checks": { "same-workload": true, "quality-noninferior": true },
  "failures": [],
  "passed": true,
  "families": [
    {
      "scenarioId": "backend-change",
      "expectedAttempts": 3,
      "pairedAttempts": 3,
      "exact": true,
      "issues": [],
      "baselineTokenTraffic": 300000,
      "candidateTokenTraffic": 180000,
      "totalTokenTrafficRatio": 0.6,
      "baselineApiEquivalentCostUsd": 0.3,
      "candidateApiEquivalentCostUsd": 0.18,
      "apiEquivalentCostRatio": 0.6,
      "candidateSubagentSessions": 0,
      "candidateSubagentTraffic": 0,
      "maximumSubagentSessionsPerAttempt": 0,
      "candidateAttempts": 3,
      "subagentEvidenceComplete": true
    },
    {
      "scenarioId": "frontend-change",
      "expectedAttempts": 3,
      "pairedAttempts": 3,
      "exact": true,
      "issues": [],
      "baselineTokenTraffic": 300000,
      "candidateTokenTraffic": 180000,
      "totalTokenTrafficRatio": 0.6,
      "baselineApiEquivalentCostUsd": 0.3,
      "candidateApiEquivalentCostUsd": 0.18,
      "apiEquivalentCostRatio": 0.6,
      "candidateSubagentSessions": 0,
      "candidateSubagentTraffic": 0,
      "maximumSubagentSessionsPerAttempt": 0,
      "candidateAttempts": 3,
      "subagentEvidenceComplete": true
    }
  ],
  "totalTokenTraffic": {
    "complete": true,
    "expectedScenarioFamilies": 2,
    "completeScenarioFamilies": 2,
    "ratio": 0.6,
    "ratioConfidence95": { "lower": 0.6, "upper": 0.6, "sampleUnit": "scenario-family", "scenarioCount": 2 },
    "ratioConfidence95Raw": { "lower": 0.6, "upper": 0.6, "sampleUnit": "scenario-family", "scenarioCount": 2 },
    "aggregateBaselineTokens": 600000,
    "aggregateCandidateTokens": 360000,
    "aggregateRatio": 0.6,
    "deltaPercent": -40
  },
  "apiEquivalentCost": {
    "complete": true,
    "expectedScenarioFamilies": 2,
    "completeScenarioFamilies": 2,
    "ratio": 0.6,
    "ratioConfidence95": { "lower": 0.6, "upper": 0.6, "sampleUnit": "scenario-family", "scenarioCount": 2 },
    "ratioConfidence95Raw": { "lower": 0.6, "upper": 0.6, "sampleUnit": "scenario-family", "scenarioCount": 2 },
    "aggregateBaselineUsd": 0.6,
    "aggregateCandidateUsd": 0.36,
    "aggregateRatio": 0.6,
    "deltaPercent": -40
  },
  "subagents": {
    "candidateAttempts": 6,
    "sessions": 0,
    "tokenTraffic": 0,
    "trafficShare": 0,
    "maximumObservedSessionsPerAttempt": 0
  }
}
